"title","description","board","image","link"
"The Complete Menopause Weight Loss Checklist","The Complete Menopause Weight Loss Checklist: Daily hormone smoothie | Anti-inflammatory eating | Strength training 3x/week | Sleep 7-8 hours (non-negotiable) | Manage stress with adaptogens. Full protocol at smoothie.thehappy-healthy-life.com #weightloss #over40 #womenshealth #menopause #perimenopause #hormones","Weight Loss Tips for Women Over 40","https://pin-images.pages.dev/w9_d6_p4_01.jpg","https://smoothie.thehappy-healthy-life.com"
"Your Body Is Not Broken — It's Changing. Here's How to Help.","Your Body Is Not Broken — It's Changing. Here's How to Help. — Compassionate, science-based approach to menopause. Full protocol at smoothie.thehappy-healthy-life.com #weightloss #over40 #womenshealth","Motivation & Mindset","https://pin-images.pages.dev/w9_d6_p4_02.jpg","https://smoothie.thehappy-healthy-life.com"
"10 years younger is how women following the hormone diet feel","10 years younger is how women following the hormone diet feel. Feel younger →. Full protocol at smoothie.thehappy-healthy-life.com #weightloss #over40 #womenshealth #transformation #weightlossjourney","Weight Loss Transformation","https://pin-images.pages.dev/w9_d6_p4_03.jpg","https://smoothie.thehappy-healthy-life.com"
"The Menopause Hormone Reset Protocol","The Menopause Hormone Reset Protocol: Morning: Anti-inflammatory smoothie | Midday: Phytoestrogen-rich lunch | Afternoon: Adaptogen supplement | Evening: Magnesium + protein dinner | Night: Cool dark room for deep sleep. Full protocol at smoothie.thehappy-healthy-life.com #weightloss #over40 #womenshealth #menopause #perimenopause #hormones","Weight Loss Meal Recipes for Women Over 40","https://pin-images.pages.dev/w9_d6_p4_04.jpg","https://smoothie.thehappy-healthy-life.com"
"The Smoothie That Supports Hormones All the Way Through Menopause","The Smoothie That Supports Hormones All the Way Through Menopause — One recipe. Formulated for the transition.. Full protocol at smoothie.thehappy-healthy-life.com #weightloss #over40 #womenshealth #menopause #perimenopause #hormones #smoothie #healthysmoothie","Fat Burning Smoothies for Women Over 40","https://pin-images.pages.dev/w9_d6_p4_05.jpg","https://smoothie.thehappy-healthy-life.com"
