title,description,board,image,link
The Morning Smoothie That Resets Your Hormones in 5 Minutes,"Drink the hormone reset smoothie within the first 60 minutes of waking — in the cortisol window. This timing tells cortisol it doesn't need to spike further, blunting the morning cortisol peak that causes belly fat. #hormonesmoothistiming #smoothietiming #morningsmoothie #cortisolsmoothi #bellyfatmorning #smoothiediet",Weight Loss for Women Over 40,https://pin-images.pages.dev/w10_d5_p2_01.jpg,https://smoothie.thehappy-healthy-life.com
The 5-Ingredient Hormone Reset Morning Smoothie,"These 5 ingredients cover the 5 hormone levers: cortisol (ashwagandha), inflammation (blueberries), gut lining (collagen), estrogen (flax), and energy (magnesium from spinach). 5 minutes, 5 systems. #5ingredienthormone #morningsmoothie #hormonesmoothie #cortisolfood #smoothiediet #bellyfatfoods",Weight Loss for Women Over 40,https://pin-images.pages.dev/w10_d5_p2_02.jpg,https://smoothie.thehappy-healthy-life.com
30g protein in the first hour after waking reduces cortisol significantly,30g protein in the first hour after waking reduces cortisol and prevents the morning glucagon spike that stores belly fat. The hormone reset smoothie + collagen powder delivers this in one 5-minute glass. #morningprotein #30gprotein #proteinandcortisol #bellyfatprotein #morningsmoothie #weightlossover40,Weight Loss for Women Over 40,https://pin-images.pages.dev/w10_d5_p2_03.jpg,https://smoothie.thehappy-healthy-life.com
Wait 90 Minutes Before Your Morning Coffee,"Drinking coffee immediately after waking spikes cortisol during its natural peak, amplifying the effect. Waiting 90 minutes for cortisol to drop naturally before coffee prevents the belly fat storage spike. #coffeetiming #cortisolcoffee #morningcoffeetiming #cortisol #bellyfatcoffee #morningroutinefor40s",Weight Loss for Women Over 40,https://pin-images.pages.dev/w10_d5_p2_04.jpg,https://smoothie.thehappy-healthy-life.com
The Optimal Morning Schedule for Hormone Balance,This morning schedule is designed around cortisol's natural rhythm. Each step either supports natural cortisol patterns or prevents unnecessary spikes. Women who follow it for 2 weeks report dramatic belly changes. #morningschedule #hormoneroutine #cortisoltiming #bellyfatmorning #morningprotocol #weightlossover40,Weight Loss for Women Over 40,https://pin-images.pages.dev/w10_d5_p2_05.jpg,https://smoothie.thehappy-healthy-life.com
