"title","description","board","image","link"
"The Hormone-Syncing Morning Smoothie (Made in 3 Minutes)","The Hormone-Syncing Morning Smoothie (Made in 3 Minutes) — Designed for each phase of your cycle. Full protocol at smoothie.thehappy-healthy-life.com #weightloss #over40 #womenshealth #smoothie #healthysmoothie #guthealth #morningroutine #morningmotivation","Metabolism Boosting Drinks Women Over 40","https://pin-images.pages.dev/w9_d5_p3_01.jpg","https://smoothie.thehappy-healthy-life.com"
"2x fewer afternoon cortisol spikes when protein is eaten before 9am","2x fewer afternoon cortisol spikes when protein is eaten before 9am. Eat protein early →. Full protocol at smoothie.thehappy-healthy-life.com #weightloss #over40 #womenshealth #cortisol #cortisolbelly #hormones #bellyfat","Hormonal Belly Fat Tips","https://pin-images.pages.dev/w9_d5_p3_02.jpg","https://smoothie.thehappy-healthy-life.com"
"Your 7am-9am Hormone Window","Your 7am-9am Hormone Window: Highest cortisol of the day (normal) | Prime time for protein metabolism | Best window for exercise | When smoothie works hardest | Critical for blood sugar control. Full protocol at smoothie.thehappy-healthy-life.com #weightloss #over40 #womenshealth #morningroutine #morningmotivation","Morning Routines for Weight Loss","https://pin-images.pages.dev/w9_d5_p3_03.jpg","https://smoothie.thehappy-healthy-life.com"
"How Your Morning Sets Your Metabolism for the Entire Day","How Your Morning Sets Your Metabolism for the Entire Day — The first 2 hours determine fat burning for 24h. Full protocol at smoothie.thehappy-healthy-life.com #weightloss #over40 #womenshealth #morningroutine #morningmotivation","Metabolism Boost After 40","https://pin-images.pages.dev/w9_d5_p3_04.jpg","https://smoothie.thehappy-healthy-life.com"
"4.5x more weight lost by women who eat breakfast consistently","4.5x more weight lost by women who eat breakfast consistently. Make breakfast count →. Full protocol at smoothie.thehappy-healthy-life.com #weightloss #over40 #womenshealth","Weight Loss for Women Over 40","https://pin-images.pages.dev/w9_d5_p3_05.jpg","https://smoothie.thehappy-healthy-life.com"
