"title","description","board","image","link"
"How Adaptogens Reset Your Hormones After 40 (Science-Based)","How Adaptogens Reset Your Hormones After 40 (Science-Based) — The ancient remedies modern medicine is catching up to. Full protocol at smoothie.thehappy-healthy-life.com #weightloss #over40 #womenshealth #supplements #naturalwellness","Natural Supplements & Wellness","https://pin-images.pages.dev/w9_d4_p3_01.jpg","https://smoothie.thehappy-healthy-life.com"
"2x more belly fat lost by women using adaptogens vs placebo","2x more belly fat lost by women using adaptogens vs placebo. Try adaptogens →. Full protocol at smoothie.thehappy-healthy-life.com #weightloss #over40 #womenshealth #bellyfat #hormones","Hormonal Belly Fat Tips","https://pin-images.pages.dev/w9_d4_p3_02.jpg","https://smoothie.thehappy-healthy-life.com"
"Ashwagandha Smoothie: The Full Recipe","Ashwagandha Smoothie: The Full Recipe: 1 frozen banana | 1 cup almond milk | 1 tsp ashwagandha powder | 1 tsp cinnamon | 1 tbsp almond butter | 1 date (sweetener). Full protocol at smoothie.thehappy-healthy-life.com #weightloss #over40 #womenshealth #smoothie #healthysmoothie #guthealth #ashwagandha #adaptogens","Metabolism Boosting Drinks Women Over 40","https://pin-images.pages.dev/w9_d4_p3_03.jpg","https://smoothie.thehappy-healthy-life.com"
"The Stress-Cortisol- Weight Connection Explained Simply","The Stress-Cortisol- Weight Connection Explained Simply — Why you gain weight when you're stressed over 40. Full protocol at smoothie.thehappy-healthy-life.com #weightloss #over40 #womenshealth #cortisol #cortisolbelly #hormones #bellyfat","Hormonal Belly Fat Tips","https://pin-images.pages.dev/w9_d4_p3_04.jpg","https://smoothie.thehappy-healthy-life.com"
"83% of users report better sleep with ashwagandha after 4 weeks","83% of users report better sleep with ashwagandha after 4 weeks. Sleep to lose weight →. Full protocol at smoothie.thehappy-healthy-life.com #weightloss #over40 #womenshealth #supplements #naturalwellness #ashwagandha #adaptogens","Natural Supplements & Wellness","https://pin-images.pages.dev/w9_d4_p3_05.jpg","https://smoothie.thehappy-healthy-life.com"
