title,description,board,image,link
This Week Could Be the Week Your Belly Starts to Change,"Every week that passes without addressing cortisol is another week of belly fat stored. This week could be week 1 of the hormone reset — or week 4, or week 8. But only if you start. The protocol is 5 minutes. #bellyfatweek1 #startthisweek #smoothiedietstart #hormonereset #bellyfatloss #menopauseweightloss",Weight Loss Transformation,https://pin-images.pages.dev/w10_d7_p2_01.jpg,https://smoothie.thehappy-healthy-life.com
Why Women Over 40 Finally Succeed at Belly Fat Loss,Women over 40 who finally lose belly fat share these 5 patterns. Not harder workouts. Not stricter diets. A hormonal approach that works with the biology of an over-40 body. #bellyfatfinallylost #hormoneapproach #over40bellyfat #smoothiediet #hormonebalance #menopauseweightloss,Weight Loss Transformation,https://pin-images.pages.dev/w10_d7_p2_02.jpg,https://smoothie.thehappy-healthy-life.com
5 days is when women first feel the hormonal shift starting,"The first hormonal shift is felt on day 5 of the protocol — typically as slightly better sleep, more stable energy, or reduced afternoon cravings. Day 5 is the proof point that the cortisol reset is working. #day5smoothie #firstshift #hormoneday5 #bellyfatday5 #smoothiediet #hormonereset",Weight Loss Transformation,https://pin-images.pages.dev/w10_d7_p2_03.jpg,https://smoothie.thehappy-healthy-life.com
"One Year from Now, Your Body Could Look Completely Different","One year of consistent hormone reset smoothie protocol: cortisol normalized, inflammation low, belly flat, energy reliable, sleep deep. The 21 days gets you started. The year is the transformation. #oneyeartransformation #yearofhormone #bellyfat1year #hormonereset #smoothiediet #menopausetransformation",Weight Loss Transformation,https://pin-images.pages.dev/w10_d7_p2_04.jpg,https://smoothie.thehappy-healthy-life.com
Your 12-Month Hormone Reset Vision,This is the 12-month horizon of the hormone reset protocol. It starts with 21 days. It compounds into a year. And the result is a body and hormonal system that works for you — not against you. #12monthhormone #longtermbellyfat #smoothiedietyear #hormonerestyear #menopauselong #weightlossover40,Weight Loss Transformation,https://pin-images.pages.dev/w10_d7_p2_05.jpg,https://smoothie.thehappy-healthy-life.com
